Column1;Column2;Column3
Username;Comment;Time
@SalsabillahEffendy;"Kalau Masi banyak yg korupsi di Indonesia susa mau maju biar mau di kasi bagi mana ?
Apa lagi kalau di lindungi korupsi";2 jam yang lalu
@emiramira77;Aku tdk yakin prabowo bisa menyejahterakan rakyat,harga harga sembako selangit,byk phk,cari kerja sulit,krn pekerjaannya sdh di bagi sm pendukungnya;6 jam yang lalu
@DeddyRewang;Hebat...Prabowo Subianto mengangkat citra sdm rakyat indonesia di dunia dan dampak positive yg besar utk kita . (salam hormat dari timika papua ) cerdas SMART;7 jam yang lalu
@bennyoekasah9687;Aneh juga,padahal rakyatnya susah,anak mudanya keluar dulu,jadi bingung kenyataan dan apa yang di katakan ngga nyambung;9 jam yang lalu
@Loverhh275;Baik dan bijaksana peduli dan kharismatik❤;10 jam yang lalu
@RangkaianNarasi;SELAMATKAN INDONESIA DENGAN SAHKAN RUU SITA ASET DAN HUKUM MATI KORUPTOR.;11 jam yang lalu
@darwinsutan6679;Ooooo Rupanya Di Era Joko Republik Ini Tidur Nyenyak wha...ha..ha... Bravo Jendral Republik Kembali Ada Dimata Dunia 👍👍;13 jam yang lalu
@rempahbumiagro2109;Pemimpin berkelas;13 jam yang lalu
@risONE-s4i;Mantap bos... maju 2 periode;13 jam yang lalu
@bahruddinmanik2213;Semoga amanah buat bpk prabowo jd pemimpin G 20;13 jam yang lalu
@batamavac9495;Pak prabowo sangat hebat dia adik daya dunia dia pemberani dimanapun dia berada dia petarung dunia;13 jam yang lalu
@Thomasdkk;Alhamdulillah;14 jam yang lalu
@RonieRichie86;Semoga anda beruntung Mr. President;14 jam yang lalu
@putra-fk4ye;Tarik hutang negara tapi ngasih uang kenegara lain secara cuma2 apa ingin dipuji atau gmn banyak impor sedangkan negara sendiri aja susah jualannya ditambah impor;14 jam yang lalu
@ErnaWati-ds4ki;INDONESIA DI MATA DUNIA SGT DI HARGAI DAN DI KAGUMI❤❤❤,JUSTRU DI DLM BANGSA SENDIRI BXK HASUTAN PARA PEMBENCI 🤣🤣🤣 ANGEEEL2 🤣🤣🤣🤣;15 jam yang lalu
@arifkuswandi4276;Allhamdulilah semoga BPK Prisiden kita Selalu Dilindungi oleh Allah SWT amin YRA❤❤❤❤❤;15 jam yang lalu
@ujangrukmana5935;Selamat Pak Prabowo, semoga NKRI sukses.;15 jam yang lalu
@heruprayogo7257;Apalah artinya jika fakta dilapangan berbeda;16 jam yang lalu
@LesmanaLesmana-k3e;Itu yg bnyak ksih poling pSti bnyakan org indo 😂;16 jam yang lalu
@BLANKSPOT-u2r;Untuk investor Nggak usah buka pabrik di indonesia banyak ormas dan serikat buruh ,kacau minta jatah mulu....dan suka demo minta naik gaji...;16 jam yang lalu
@wellisazkia6703;Manfaat populer itu apa ya? Negara ini susah itu fakta.;16 jam yang lalu
@DavidMunggu;Asalkan korupsi da dan aparat di awasi indonesia cepat maju,pemyakit nya itu huruf ngain mulut ngangak perut bumcit makan duit korupsi gak kenyang2😅;16 jam yang lalu
@hakisrinoto4523;Yaa Allah..... Atas Ridho dan kuasaMU, jadikanlah kami rakyat Indonesia, rakyat yang makmur dan sll mendapatkan keberkahan dariMU...... Aamiin 🤲🙏;17 jam yang lalu
@hakisrinoto4523;Maju terus Pak Prabowo...... Maju terus Bangsa dan Rakyat Indonesia;17 jam yang lalu
@GustianAgus-k5t;Apakah pendukung sebelah yg kiri kanan tuh panas liat ini yah..😂😂;17 jam yang lalu
@Sumaryono-j1l;Pak prabowo memang tdk kaleng2 beliau bukan keturunan org sembarangan dan menantu mantan presiden super powernya indonesia dan juga orgnya pinter lulusan amerika dan dari pasukan elit indonesia KOPASUS.;17 jam yang lalu
@MimiAurora-v3w;Makan beracun gratis apa yg di banggakan;17 jam yang lalu
@RohmansssSyaii;Atau sdh kasian pun seepoh pk jokowiii wes wayae libur kumpul okeh okeh kro anak lan ank bojonee hehe;17 jam yang lalu
@RohmansssSyaii;Bisa juga bapkn pemimpin bila jelemit bisa pamggil bpk jokowi untuk datang dari pada memutuskn kputuskn merugikn...;17 jam yang lalu
@FoneniPay-b4c;Mantap pak prabowo kami sebagai Indonesia bangga;17 jam yang lalu
@andryberkarya;Biar tekor asal ke sohor😂🎉😢😮😅😊😅😮😂😂😂🎉😢😅😊😅😢😂😂🎉😢😮😅😊😊😢😂🎉😮😅😊;17 jam yang lalu
@RizalAbufatih;Gini aja anak abah gak bakalan ada bangganya...;18 jam yang lalu
@ganisri-gx7ln;Ini reporter nggak tahu U15 juara dunia dalam sepakbola;18 jam yang lalu
@SirodSitod;Rakyat Indonesia tidak butuh hanya sekedar kepopuleran , 1:56  TAPI  Indonesia  membutukan Pemimpin  yg Sesuai omongannya Tegas  nyata pro Rakyat  .;18 jam yang lalu
@DafaAlfa-t7n;Bangga dngan presiden kita skg.sehat sllu pak prabowo.insyallah indonesia lebih baik lagi.amin;18 jam yang lalu
@palekocaketv;"Kita tunggu hasilnya dlm pertumbuhan ekinomi 8% yg dijanjikan itu prestasi untuk rakyat yg memilihnya , good job . 
2026 , 2027 , 2028 , 2029 
❤ persatuan indonesia🎉 itu yg bisa menaikan pertumbuhan ekonomi . Faham";18 jam yang lalu
@iswantoiswanto4332;Saya bangga banget presiden saya terpopuler didunia,,selamat buat bpk prabowo ❤;19 jam yang lalu
@YosephPrasetia;"Diluar negeri diakui org luar negeri,
Di dlm negeri bikin pusing masyarakat dgn segala kebijakannya yg blm pro rakyat";19 jam yang lalu
@adestronyess9099;Sedunia mengamini kebaikan dan keseriusan pk prabowo, jika ada yg nyentil sinis kepada beliau keterlaluan,;19 jam yang lalu
@umbulsawunggaling7042;"Tumpuan terbesar kita pada Danantara. Saya sependapat dengan Koh Raymond Chin.
Dengan potensi besar di sektor hilirisasi produk-produk ungguan dunia, maka berpotensi besar pula menarik FDI (Foreign Direct Investmens). Pasti G20 melihat potensi itu, terutama bagi terciptanya berbagai kesepakatan kerjasama ekonomi dengan mereka.
Congratulations Pak Prabowo.";19 jam yang lalu
@mardimagelang2161;Melihat pak Prabowo itu simpel KLO paham dgn tujuan beliau satu satunya tokoh yg duniawi pribadinya sudah tercukup dan finali tapi beliau menyimpan cita cita luhur untuk bangsa ini.yaitu ingin melihat bangsa indonesia maju makmur kuat dan berintegritas sejajar dgn negara dan bangsa lain didunia dan rayatnya makmur.itu aja.the pak prabowo❤❤❤❤❤;19 jam yang lalu
@bangpei967;sudah mulai digoyang konsorsium aki2 ex ABRI,jalan tegak lurus dan tegap pak Prabowo...jgn takut dengan antek2 barat..;19 jam yang lalu
@febry-r6t;preeettttt;19 jam yang lalu
@nurulcyk2762;Mana yg suka xixir kok gak muncul;19 jam yang lalu
@hermanwal5803;Semoga tambah jaya indonesia;19 jam yang lalu
@margakhailul2271;Ya Allah berikan pak prabowo kesehatn dan kekuatan panjang umur.dlm memimpin negara.Amin;19 jam yang lalu
@HerlandsyahMr-xn6fs;Sumpah gua baru ngrasain Indonesia punya prsiden;19 jam yang lalu
@sukaryokaryo3581;Akhirnya penilai 11 klonjotan semakin gak bisa bayar hutang. Masihkah sombong rt lobet dan rt 24.....?;20 jam yang lalu
@masenang7613;Luar biasa, di global ada istilah titipan survey tdk ya...😂, Kalau surveynya ke pengamat dan konten creator indonesia gmn😂 ya?..;20 jam yang lalu
@FansPrabowo08;"jangan cepat puas , kita harus rendah hati tapi jangan rendah diri "" presiden Prabowo Subianto""
Sehat selalu bapak 🇮🇩❤️🤍";20 jam yang lalu
@Yanrafathar;Top Pak prabowo;20 jam yang lalu
@SitiSuryani-k9t;Orang 2 yg udah berhati benci gak mungkin mau mengakui keunggulan lawan 😊 meskipun yg benci se upil tapi bisa menggangu pemerintah an BPK Prabowo Subianto 😢 meskipun dunia mengakui kehebatan Presiden kita 🎉 pembenci tetap lah berhati hitam 😊😊;20 jam yang lalu
@pendiksetiono;Joss, Indonesia terang;20 jam yang lalu
@achomustan;Pengamat sesat selalu mengutamakan keraguan dibanding keberhasilan prabowo... inila pengamat konsisten dngn watak negatifnya terhadap pemerintah😂;20 jam yang lalu
@pujutkatajur9247;Apa yg mau di Bangakan dengan G20 toh tidak ada dampaknya,,yg ada cuma kesengsaraan rakyat,,,,;20 jam yang lalu
@1931-n2d;Luar biasa bapak;20 jam yang lalu
@udinmagebo352;Kok popularitas di G20 ngaruh ke program MBG si? 😂;21 jam yang lalu
@iskandarzulkarnaen4729;Selamat untuk Bapak Presiden Prabowo sebagai pemimpin terpopuler dunia selalu sehat cerdas sukses panjang umur dan bisa menjadikan Indonesia maju;21 jam yang lalu
@bennyasa826;Terpopuler omon omonnya;21 jam yang lalu
@adihariramijan6741;Rakyat butuh pekerjaan dan kebutuhan yg terjangkau.;21 jam yang lalu
@arifsugianto2129;Kerjaan  banyak,, tinggal orangy;16 jam yang lalu
@Berkah9093;Kurang kreatif;15 jam yang lalu
@SENANDUNGRIA;"Bersakit"" dahulu,, bersenang"" kemudian. Masih & harus berjuang.. ga ada kesejahteraan tanpa perjuangan.";4 jam yang lalu
@AJAYSWAN;Prabowo: Jangan Bangga Jadi Anggota G20 Kalau Rakyat Kita Masih Miskin;21 jam yang lalu
@hayrul6044;"Siapa yang melakukan vote? 
Kalau publik secara umum jelas dari indonesia, taukan netizen indo kaya apa?";21 jam yang lalu
@darahnkri1173;"Kata Almarhum Gus Dur..
Kalo orang yg paling IKHLAS kpd Rakyat Indonesia itu Prabowo + Prabowo akan jd Presiden RI di masa Tua ☝️🇮🇩

Kata Panda Nababan Prabowo satu2 ny Presiden RI yg tanpa campur tangan 9 Naga oligarki Krn biaya nyapres sendiri + di bantu adik dan kluarga ny yg TRILIUNER .. maka nya Prabowo GALAK tdk ada yg berani DIKTE ✊💪🇮🇩

Di Republik ini tdk ada yg bisa men DIKTE sang PATRIOT sejati lebih TNI dr bnyak TNI purn Panglima Komando Strategi Angkatan Darat dan Purn Komandan Jenderal Kopassus Presiden RI ke 8 Haji Prabowo Subianto trsbut ✊💪🇮🇩

Tercatat dlm Sejarah Republik ini Prabowo berkali2 pertaruhkan NYAWA hingga Bbrp x hmpir TERB*NUH ketika di kepung Fretelin bkn hnya PETENTANG PETENTENG di blkg tp angkat senjata di GARDA terdepan demi MERAH PUTIH ❤🇮🇩✊💪

Prabowo bkn level2 gubernur.. beliau jauh lbh UNGGUL dr smua LINI 
Prabowo Subianto Sangat MUMPUNI di KANCAH Internasional Penuturan Bahasa Inggris TANPA TEKS jg tanpa I Pad Sangat FASIH mampu meyakinkan pemimpin2 DUNIA / tdk malu2 in BANGSA Indonesia krn beliau Besar Skolah di Jerman, Prancis, Inggris, dll..,dr Segi Ekonomi beliau Sangat Menguasai sbb beliau Pebisnis Sukses Migas dll di lahirkan ke muka bumi ini Dr Putra Begawan Ekonomi Sumitro Djojohadikusumo, cucu Pahlawan Raden Margono pendiri Bank BNI bnyak lg Jam TERBANG Beliau, maka nya beliau tau uang Negara itu BOCOR tp di Ejek2 di HINA2.. BOCOR2 krn yg Menghina Beliau, komplotan on ta dn komplotan ke bo barisan sakit hati para pecundang RT 16 RW 24 yg hati nya Bu suk di penuhi ib Lis see taan trsbut 👈🤮

Prabowo sangat Menguasai Strategi Militer, Geografi Teritorial Kedaulatan Negara Kesatuan Republik Indonesia Raya yg beliau sangat CINTA i ini .. bahwa Republik Indonesia di Kepung negara2 COMMONWEALTH jg Teritorial Natuna, Ambalat dll biar tdk ada yg berani coba-coba mengOBOK2 kedaulatan NKRI.. hanya yg CERDAS yg PAHAM dgn smua SUSUN ATUR KETIKAN BAHASA saya ini kcuali geng2 ke bo dan geng2 on ta trsbut 👈


Yg omon omon itu yaman pelaku korupsi formula E dan janggar pelaku korupsi e KTP bntr lg masuk bui 🤮🤮🤮🤮🤮

Berani SUMPAH 7 keturunan yg nyinyir kejang2 kelojotan baca smua cmmnt gue ini yaitu komplotan on ta dan komplotan ke bo barisan sakit hati para pecundang trsbut 👈👎👎

Prabowo - Gibran 2024 -2029 ✊✊💪💪❤️❤️🇮🇩🇮🇩";21 jam yang lalu
@kurohiki;Sejak isu program pangan sukses besar, pandangan masyarakat mengarah ke positif;21 jam yang lalu
@RudySantoso-x2s;Sehat selalu panjang umur pk Prabowo untuk indonesia maju  10 THN ke depan;21 jam yang lalu
@nafsiahvivo4846;SAYANG WAKILNYA 😅😅;21 jam yang lalu
@tamo_45;Dia aja hidup jokowi..sama antek2 nya;21 jam yang lalu
@tamo_45;Apa yg mau diharapkan dr presiden ini😂😂😂😂 omon omon;21 jam yang lalu
@ZaenudinUsman;Fersi apa itu ??? 😂😂😂 populer di bidang apa itu,???;21 jam yang lalu
@azmailiaziz8941;Sy sangat kagum ketika beliau disupiri  raja jordan blm ada pemimpin dunia spt ini.begitu sangat solmed dg raja jordan;21 jam yang lalu
@AyuFiesta-d2l;Semoga allah SWT mmberi kesehatan dan umur pnjg buat pk prabowo km rakyt kecil sngt bangga;21 jam yang lalu
@azmailiaziz8941;Smg terwujud apa yg di inginkan beliau indonesia macan asia. Awal kebangkitan indo .era skrg beliau jd presiden terpoler .mengharumkan indo. Pengganti sukarno;21 jam yang lalu
@AyuFiesta-d2l;Yakin pk prabowo bisa mmbwa negri ini bisa makmur sejahtera. Blm ada presiden seprti beliau trtm swasembada pangn;21 jam yang lalu
@widinatha;"Baiknya MBG' kasih cash sj pd ortu murid..biarkan murid bw nasi k sklh hasil masak ibunya.
dgn cttn pihak Sekolah' tetap, memfasilitasi tmpt &wkt utk acara makan brsm tsb.";21 jam yang lalu
@agusrianto8282;Hanya soekarna dan prabowo yg seperti ini;21 jam yang lalu
@HendriAgustian-ki1wb;Presiden Prabowo ..👍;21 jam yang lalu
@HendriAgustian-ki1wb;"Presiden Prabowo Presiden Terpengaruh Didunia Skrg Udah Terbukti ..👍
Alhamdillah ..✍️";21 jam yang lalu
@AryYurgantara;Kl mewancarai org itu mbok yg lancar berbicara bkn yg a,e a,e buat males dengar...;21 jam yang lalu
@azmailiaziz8941;Beliau sangat aktiv .bukan sekedar kunjungan kerja tp jg jago lobi tu keamanan dunia .rata2 pemimpin dunia teman beliau;21 jam yang lalu
@Johniepurnawan;Bang hendri datanya luar biasa. Terjun langsung kelapangan dia. Ngobrol brg masyarakat langsung. Panutan memang!!!;21 jam yang lalu
@darahnkri1173;"Kata Almarhum Gus Dur..
Kalo orang yg paling IKHLAS kpd Rakyat Indonesia itu Prabowo + Prabowo akan jd Presiden RI di masa Tua ☝️🇮🇩

Kata Panda Nababan Prabowo satu2 ny Presiden RI yg tanpa campur tangan 9 Naga oligarki Krn biaya nyapres sendiri + di bantu adik dan kluarga ny yg TRILIUNER .. maka nya Prabowo GALAK tdk ada yg berani DIKTE ✊💪🇮🇩

Di Republik ini tdk ada yg bisa men DIKTE sang PATRIOT sejati lebih TNI dr bnyak TNI purn Panglima Komando Strategi Angkatan Darat dan Purn Komandan Jenderal Kopassus Presiden RI ke 8 Haji Prabowo Subianto trsbut ✊💪🇮🇩

Tercatat dlm Sejarah Republik ini Prabowo berkali2 pertaruhkan NYAWA hingga Bbrp x hmpir TERB*NUH ketika di kepung Fretelin bkn hnya PETENTANG PETENTENG di blkg tp angkat senjata di GARDA terdepan demi MERAH PUTIH ❤🇮🇩✊💪

Prabowo bkn level2 gubernur.. beliau jauh lbh UNGGUL dr smua LINI 
Prabowo Subianto Sangat MUMPUNI di KANCAH Internasional Penuturan Bahasa Inggris TANPA TEKS jg tanpa I Pad Sangat FASIH mampu meyakinkan pemimpin2 DUNIA / tdk malu2 in BANGSA Indonesia krn beliau Besar Skolah di Jerman, Prancis, Inggris, dll..,dr Segi Ekonomi beliau Sangat Menguasai sbb beliau Pebisnis Sukses Migas dll di lahirkan ke muka bumi ini Dr Putra Begawan Ekonomi Sumitro Djojohadikusumo, cucu Pahlawan Raden Margono pendiri Bank BNI bnyak lg Jam TERBANG Beliau, maka nya beliau tau uang Negara itu BOCOR tp di Ejek2 di HINA2.. BOCOR2 krn yg Menghina Beliau, komplotan on ta dn komplotan ke bo barisan sakit hati para pecundang RT 16 RW 24 yg hati nya Bu suk di penuhi ib Lis see taan trsbut 👈🤮

Prabowo sangat Menguasai Strategi Militer, Geografi Teritorial Kedaulatan Negara Kesatuan Republik Indonesia Raya yg beliau sangat CINTA i ini .. bahwa Republik Indonesia di Kepung negara2 COMMONWEALTH jg Teritorial Natuna, Ambalat dll biar tdk ada yg berani coba-coba mengOBOK2 kedaulatan NKRI.. hanya yg CERDAS yg PAHAM dgn smua SUSUN ATUR KETIKAN BAHASA saya ini kcuali geng2 ke bo dan geng2 on ta trsbut 👈


Yg omon omon itu yaman pelaku korupsi formula E dan janggar pelaku korupsi e KTP bntr lg masuk bui 🤮🤮🤮🤮🤮

Berani SUMPAH 7 keturunan yg nyinyir kejang2 kelojotan baca smua cmmnt gue ini yaitu komplotan on ta dan komplotan ke bo barisan sakit hati para pecundang trsbut 👈👎👎

Prabowo - Gibran 2024 -2029 ✊✊💪💪❤️❤️🇮🇩🇮🇩";21 jam yang lalu
@sunaryonaryo6769;Harusnya beliau jadi presiden dari dulu lebih baik drpd Mulyono Krn lebih bermartabat Dimata dunia internasional;18 jam yang lalu
@L.334-e9l;tapi Abah hanya memberi nilai 11%/100% loh😂😂;15 menit yang lalu
@sallsagrenada6034;Bubarkan dulu ormasnya terutama peliharaan PDI investor pasti datang berbondong² tanpa gangguan sampah masyarakat;22 jam yang lalu
@LaluMashuriMuliadi;Kami rakyat Indonesia bangga punya pemimpin kelas dunia ..presiden Prabowo Subianto...;22 jam yang lalu
@Diengamnayou;Luar biasa keseriusan dan  ketegasan pak Prabowo membawah dampak terbaik di mata dunia 👍;22 jam yang lalu (diedit)
@abdulkholikbasoribasori4129;PM Malaysia no berapa;22 jam yang lalu
@EnengDede-g5u;"Alhamdulillah,,, Maju terus Bapak Presiden Ku,,, H. Jendral Prabowo Subianto,,, 
👍👍🇮🇩🇮🇩
Semoga kedepan Indonesia lebih di kenal dan di kagumi juga di segani oleh negara2 lain di Dunia,,, 

Maju terus Bapak ku,,,, Indonesia Maju Generasi Emas,,, 
Sehat2 selalu Bapak Ku,,, 👍👍🙏🙏❤❤
Bravo Indonesia,,, dan semoga Rakyat Indonesia Lebih Makmur dan Sejahtera,,, Damai dan Tentram,,, Berbudi baik dan bertutur bahasa yg baik juga berakhlak mulia menjunjung persatuan bangsa yg bersahaja,, Aamiin YRA🤲🤲🤲

Nkri harga mati🇮🇩🇮🇩🇮🇩👍👍👍";22 jam yang lalu
@andreaditya7;"""curang, itu hasil kecurangan, sudah dimanipulasi oleh pendukung 02"" ucap para buzzer wkwk";22 jam yang lalu
@danisdanis9413;"Semoga di pemerintahan pk Prabowo Indonesia 🇮🇩 makin maju di kancah internasional 
Seahat selalu buat bpk Prabowo ❤❤❤❤";22 jam yang lalu
@Andremaulanaw;Nah betul bang hensa.. kita masih optimis ya menanti mau dibawa kemana negeri ini.  Karena membangun sesuatu memang ga gampang. Tp kita masih optimis bang;22 jam yang lalu
@Jakpar-w2q;Mantap Prabowo  Gibran .❤❤❤❤❤❤❤❤;22 jam yang lalu
@teguhalizamzam;Alhamdulillah sy sebagai warga negara indonesia dan sebagai warga daerah jawabarat sangat bersyukur mempunyai presiden sekaliber dunia pengakuan nya(dalam bekerja serta pemikiran )dan gubernur sekaliber nasional pengakuan nya(dalam bekerja serta pemikiran) .. Saya yakin negara kita akan tumbuh maju dan jabar pun akan lebih maju terdepan.. Terimakasih pak presiden  prabowo dan Gubernur KDM;22 jam yang lalu
@rasidinazka7821;Kalau mobil smk gmna;22 jam yang lalu
@taufananindita1991;Betul kata bang hensa kita harus menjaga semangat dan optimisme bersama;22 jam yang lalu
@aditama9441;Yg vote orang indonesia semua;22 jam yang lalu
@cheanggavara7086;Pesona kosong;22 jam yang lalu
@Dodopampam1;Anis tetap di hati yaman;22 jam yang lalu
@aliwae6932;Hadeeeh.  Capek deh...bosen;22 jam yang lalu
@fantasya6292;Jooosss;22 jam yang lalu
@Apipi-f3v;kami rakyat ga butuh sanjungan dari luar negri kami butuh lapangan kerja sembako terjangkau..pelayanan kesehatan dan pendidikan berkualitas .itu yg kami inginkan;22 jam yang lalu
@Hermen3;"Setuju dengan komentar bang hendri
 "" rakyat Indonesia menyerahkan harapan dan masa depan di pundak Bapak Prabowo""
 Semoga Bapak Prabowo sehat terus dan tidak melupakan tujuan awal.";23 jam yang lalu
@fntc6317;OMON OMON,FAKTANYA DI DALAM NEGRI LAPANGAN KERJA SULIT,PHK DIMANA MANA,LAPANGAN KERJA SULIT,INVESTOR PADA HENGKANG ,ORMAS ORMAS MEMALAK.;23 jam yang lalu
@Berusaha909;Termasuk kau lah berarti😂😂;21 jam yang lalu
@RudyeX;Ijazah nya pasti asli;23 jam yang lalu
@cuan369;Prettt;23 jam yang lalu
@candrasusetyo6430;Survey Abal Abal, MBG gagal;23 jam yang lalu
@hardirock3211;Anak abah mana katanya survey di buat buat ini survey luar negeri masa indonesia yang buat😂;23 jam yang lalu
@ashmanurafifah5407;Tertarik sama metode risetnya semoga dapat bukan hanya hasilnya sehingga bisa ditelaah bersama. Tentu saja kalau program baik musti diteruskan. Teruskan opini kritisnya Bang Hendri!;23 jam yang lalu
@sitifasilah9509;Saya bangga sebagai pemilih Bpk prabowo dari 2014 sampk 2024 konsisten tidak memilih yg lain juga bukan karena gibran dan Alhamdulillah smg Bpk presiden  jadi terbaik sedunia aaamiiin;23 jam yang lalu
@BELLANEGRIKU;16 MASIH NONTON FILM BOK3P YANG 26 BUAT DOMPET SURGA , KELUAR DIKIT PAKAI KACA MATA HITAM 😂😂😂 BLM MOVE ON... GANJAL DAN AMIS 😂😂😂😂;23 jam yang lalu
@RonySetya-n1v;Malaydes nmr brp😂;23 jam yang lalu
@martinbadun5439;"Good Job Mr. Precident.
Membanggakan hati rakyatmu.
Teruslah berkarya. Tuhan memberkati Bangsamu, NKRI.";23 jam yang lalu
@bucek2247;Awalnya tolak iphone krn TKDN seperti singa, ujungnya kucing kurap TKDN dihapus Iphone boleh masuk😂😂;23 jam yang lalu
@azharKamal-g9f;"Golkar : ""memperlancar MBG"". Aduh masih aja";23 jam yang lalu
@Ahmadkuryonosw;Mantab tapi MBG banyak anak keracunan;23 jam yang lalu
@hendrimpa4073;Mantap pak 😊😊😊;23 jam yang lalu
@SevenlyLegit;TP TETEP INVESTOR PADA KABUR DARI INDO AH;23 jam yang lalu
@Mr.jacknoe;Kok gk ada master xi jinping??;23 jam yang lalu
@bimbingekoharjanto4106;Ssmua Pengamat sebaiknya Mengawal dan memotifasi  agar Negara & Pemerintahan yg menggolontorkan Program kerakyatan yg membutuhkan Dana Besar terus di dukung sekaligus di Kawal agar lembaga, menteri, Dirjen, irjen, BUMN, BUMD tidak terjadi lagi. KORUPSI yang selama ini jadi BUDAYA Pejabat harus kita Laporkan PRESIDEN. Kita Rakyat & Kita Orang Lapangan. Haris LAPOR pada BELIAU.;23 jam yang lalu
@Mr.jacknoe;MBG harus di audit korupsi terbesar 😢;23 jam yang lalu
@jokosuyanto7896;Bangganya Rakyat Indonesia mempunyai presiden Prabowo❤🫰;23 jam yang lalu
@Purwantoi7k;Data ini menurut indo aja, biasa menang di medsos aja 😅😂;23 jam yang lalu
@hend313;Belum 5 Bulan, mantap pak Prabowo.;23 jam yang lalu
@74nie490;Asli lah....temen deket nya Jokowi;22 jam yang lalu
@RudyeX;@74nie490  ah ngk yg satu itu kebanyakan drama. Mengalahkan  Drama korea;21 jam yang lalu
@Fabian-hj3kv;Malaysia masuk g20 aja gk;23 jam yang lalu
@Anji.k-r6j;gak ngaruh....gk ada manfaatnya. .presiden Vietnam gk terkenal tapi investor banyak yg masuk;23 jam yang lalu
@Gamernub01;Abah peringkat  1 di dunia halu😂;23 jam yang lalu
@yosuakedoh2536;Mantap tim yg menilai kbtulan semalaman  begadang smpe pagi mkx mrk PD ngantuk semuax😂😂😅;23 jam yang lalu
@nonsense1801;Peringkat yg tdk penting.;23 jam yang lalu
@herlambang3975;SURVEI2, termasuk Survei LN itu bisa diatur oleh yang pesan, yang penting duiiiit...😜😜😜😜😜😜😜😜😜😜😜;23 jam yang lalu (diedit)
@herlambang3975;🤭🤭🤭🤭🤭😜🤣🤣🤣🤣🤣🤣🤣🤣🤣🤣🤣🤣🤣🤣🤣🤣🤣🤣🤣🤣;23 jam yang lalu
@Freethingkers;"Itu kan cuman reguler saja.urut urutan

Prabowo itu tdk sukses domestik

Blangsak malah";23 jam yang lalu
@Prabuprafu2021;Pasti ada yang nyinyir dan mbully prestasi Pa'Prabowo sebagai Presiden RI mengalahkan beberapa Presiden - Presiden Negara Maju ✊🇮🇩✊;23 jam yang lalu
@arifrahman3592;52% Itu karena takut deh makanya di vote😂😂😂;1 hari yang lalu (diedit)
@TeinNanulaitta;Kejadian kejadian kejadian kejadian kejadian kejadian kejadian kejadian kejadian kejadian kejadian;1 hari yang lalu
@bambangsaputra5993;Setuju bang hensa , pemerintahan saat ini harus fokus perbaiki sisi ekonomi;1 hari yang lalu
@kibaltunus8762;"Warga rt 24% dan low bat 16% ngumpet kemana ya????
Pemirsa ILC dan Karni Ilyas menonton berita ini nggak??";1 hari yang lalu
@DadangSupriatna-f6l;Ya prcuma sj hnya untk trppler...mmng rakyat mau di ksh kpplran trsbut...rakyat mah yng pntng bs cr rejeki untk mnghdpi klrga dan bs mkn s'hari2 dan mdh mncri pkrjaan, kpplran ga pngruh buat rakyat kcl mah.;1 hari yang lalu
@Amed-p5p;Kirain yg paling populer pemimpin Demo mahasewa;1 hari yang lalu
@RamlanMaradika;Kalau Anis pasti 100% ,terpopuler di dunia,dalam bidang pengelolaan kata,dan pintar mengutang,🤣🤣🤣🤣;1 hari yang lalu
@SuKono-e8x;Begitu banga bangsa indonesia mempunyai pemimpin hebat2.wl negara masih kurang baik tp ttp percaya inyaalloh indonesia akan lbih baik❤❤;1 hari yang lalu
@dikasinamo563;"""mereka"" bilang pak Anies dan pak Ganjar terpopuler,tp di rumahnya masing'🤣🤣🤣";1 hari yang lalu
@nenengmulyati8497;Ini survei bagus loh di buktikan dengan data, bukan data occrp😂;1 hari yang lalu
@radityagunadharma2062;"Akan lebih mengagetkan lagi, jika Pertemuan G20 selanjutnya di indonesia, diadakan di IKN IBUKOTA NUSANTARA..
🤣😂🤣😂

Banyak Orang pembenci Jokowi & Gibran pun pasti bakalan nangis..
Hahahaha...";1 hari yang lalu
@PADLIZulfikar;Mantp prabwo❤❤❤❤❤❤❤;1 hari yang lalu
@yusufkhalwani9537;Betul itu;20 jam yang lalu
@Fabian-hj3kv;Tidak penting bagi pengangguran pendukung abah;23 jam yang lalu
@nonsense1801;"@Fabian-hj3kv  abah siapa?
Jgn berasumsi liar.

Coba jelaskan apa pentingnya peringkat2 spt itu?
Dasar menilaian sj tdk jelas. Siapa yg memberi nilai jg tdk jelas.

Lalu apa kontribusinya bg bangsa?
Bs ngurangin korupsi, preman, kriminal, & bs buka lapangan pekerjaan?
Silahkan jelaskan";23 jam yang lalu (diedit)
@ahaxyz;Memang sesakit itu ya klo kalah. Survei by Reuters padahal ... 😆;23 jam yang lalu
@Fabian-hj3kv;Survei global mana bisa diatur, apalagi survei tentang pemimpin g20;23 jam yang lalu
@Dodopampam1;Kasihan adek ini;22 jam yang lalu
@Fabian-hj3kv;Pret;23 jam yang lalu
@TheFitsan;kepanasan ya;22 jam yang lalu
@WARzone568;Ini baru pemimpin...;1 hari yang lalu
@dedehidayat9974;"para pembenci tutup mata akan hal ini...
soal ny klo mlek pasti kepanasan... 😂😂😂";1 hari yang lalu
@sittihartina1987;Syukur Alhamdulillah terbaaaaaaiiiik bpk presiden RI salam hormat sehat dan sukses selalu dalam lindungan Allah SWT dcintai dan disayangi dseluruh dunia. 😂💯❤️🇮🇩;1 hari yang lalu
@MawardiAli-h1s;Presiden RI selamanya yang berpengalaman;1 hari yang lalu
@umimohsukra3;Alhamdulillah Ya Allah ❤🇮🇩;1 hari yang lalu
@adinugraha5601;konpirasi ini mah kwk;1 hari yang lalu
@SusiloSTMM;Inilah sosok presiden yg sangat luar biasa. Bpk❤❤❤❤;1 hari yang lalu
@HAhmadUsmankemal;Yes good luck 🎉 I like this ❤❤❤❤❤❤❤;1 hari yang lalu
@KencetDengklang;Sebaik apapun pro n kontra tetap ada, klau tdk y...g ada ilmu sosiologi, phykologi;1 hari yang lalu
@Puni_puni14;Populer dr mananya ya 😂;1 hari yang lalu
@ralphalbi3511;ok;1 hari yang lalu
@sriwatimadjid9490;Tdk suka publitas ..tdk pencintraan..mode senyap..tapi...kerjax dirasakan masyarakat ..menyala Bpkq❤❤;1 hari yang lalu
